[I 2025-06-18 12:23:03,378] Trial 24 finished with value: 0.5182010582010582 and parameters: {'C': 9394.498122945917, 'gamma': 'scale', 'alpha': 0.0014263158802106444, 'l1_ratio': 0.09357212077798896}. Best is trial 10 with value: 0.6058201058201058.
[I 2025-06-18 12:23:03,527] Trial 25 finished with value: 0.5280952380952381 and parameters: {'C': 1555.247357554141, 'gamma': 'scale', 'alpha': 0.0002421469823778612, 'l1_ratio': 0.0790517308324766}. Best is trial 10 with value: 0.6058201058201058.
[I 2025-06-18 12:23:03,591] Trial 26 finished with value: 0.5185714285714286 and parameters: {'C': 5.746742788839741, 'gamma': 'scale', 'alpha': 0.000780796949400328, 'l1_ratio': 0.4450111883275781}. Best is trial 10 with value: 0.6058201058201058.
[I 2025-06-18 12:23:03,632] Trial 27 finished with value: 0.49677248677248675 and parameters: {'C': 430.383683500883, 'gamma': 'scale', 'alpha': 0.002700578644460166, 'l1_ratio': 0.2588174953829731}. Best is trial 10 with value: 0.6058201058201058.
[I 2025-06-18 12:23:03,672] Trial 28 finished with value: 0.5182010582010582 and parameters: {'C': 3078.549305024132, 'gamma': 'scale', 'alpha': 0.008757566388714248, 'l1_ratio': 0.07401704923849364}. Best is trial 10 with value: 0.6058201058201058.
[I 2025-06-18 12:23:03,780] Trial 29 finished with value: 0.5482010582010581 and parameters: {'C': 957.0801916225877, 'gamma': 'scale', 'alpha': 0.0002661381283760879, 'l1_ratio': 0.17325665465954448}. Best is trial 10 with value: 0.6058201058201058.
[I 2025-06-18 12:23:03,842] Trial 30 finished with value: 0.4833333333333333 and parameters: {'C': 0.013026267284721707, 'gamma': 'scale', 'alpha': 0.0006505772995290672, 'l1_ratio': 0.7382703298598595}. Best is trial 10 with value: 0.6058201058201058.
[I 2025-06-18 12:23:03,864] Trial 31 finished with value: 0.4833333333333333 and parameters: {'C': 1.6742121741481433, 'gamma': 'scale', 'alpha': 6.701082659726987, 'l1_ratio': 0.6500914394826922}. Best is trial 10 with value: 0.6058201058201058.
[I 2025-06-18 12:23:03,891] Trial 32 finished with value: 0.2038095238095238 and parameters: {'C': 0.13505167374933263, 'gamma': 'scale', 'alpha': 0.008973232807694622, 'l1_ratio': 0.8421901769696621}. Best is trial 10 with value: 0.6058201058201058.
[I 2025-06-18 12:23:03,915] Trial 33 finished with value: 0.4833333333333333 and parameters: {'C': 1.798003287127722, 'gamma': 'scale', 'alpha': 3.1305040312704713, 'l1_ratio': 0.43577559504476276}. Best is trial 10 with value: 0.6058201058201058.
[I 2025-06-18 12:23:04,097] Trial 34 finished with value: 0.2038095238095238 and parameters: {'C': 0.3955693757074851, 'gamma': 'auto', 'alpha': 0.00018083403174300346, 'l1_ratio': 0.05413821086993152}. Best is trial 10 with value: 0.6058201058201058.
[I 2025-06-18 12:23:04,119] Trial 35 finished with value: 0.5700000000000001 and parameters: {'C': 5.384918223419118, 'gamma': 'scale', 'alpha': 0.14415853675249668, 'l1_ratio': 0.9643269109592181}. Best is trial 10 with value: 0.6058201058201058.
[I 2025-06-18 12:23:04,142] Trial 36 finished with value: 0.4833333333333333 and parameters: {'C': 0.4510243546242504, 'gamma': 'auto', 'alpha': 2.474444528816538, 'l1_ratio': 0.9954134337744839}. Best is trial 10 with value: 0.6058201058201058.
[I 2025-06-18 12:23:04,165] Trial 37 finished with value: 0.4833333333333333 and parameters: {'C': 39.47008490991816, 'gamma': 'scale', 'alpha': 0.65990268397, 'l1_ratio': 0.8309013212237385}. Best is trial 10 with value: 0.6058201058201058.
[I 2025-06-18 12:23:04,192] Trial 38 finished with value: 0.5482010582010581 and parameters: {'C': 4302.763544279276, 'gamma': 'auto', 'alpha': 0.027128418532813517, 'l1_ratio': 0.15503064105277486}. Best is trial 10 with value: 0.6058201058201058.
[I 2025-06-18 12:23:04,281] Trial 39 finished with value: 0.39047619047619053 and parameters: {'C': 0.1392687375151988, 'gamma': 'scale', 'alpha': 0.00043510342707319625, 'l1_ratio': 0.235216329810428}. Best is trial 10 with value: 0.6058201058201058.
[I 2025-06-18 12:23:04,321] Trial 40 finished with value: 0.5082010582010582 and parameters: {'C': 84.91412821447915, 'gamma': 'auto', 'alpha': 0.003013453250506289, 'l1_ratio': 0.5729213096544417}. Best is trial 10 with value: 0.6058201058201058.
[I 2025-06-18 12:23:04,345] Trial 41 finished with value: 0.42857142857142855 and parameters: {'C': 4.936839943407334, 'gamma': 'scale', 'alpha': 0.17119986194400538, 'l1_ratio': 0.9840764884469544}. Best is trial 10 with value: 0.6058201058201058.
[I 2025-06-18 12:23:04,369] Trial 42 finished with value: 0.5395238095238095 and parameters: {'C': 4.0055246758374, 'gamma': 'scale', 'alpha': 0.16125615563470552, 'l1_ratio': 0.9020891818810013}. Best is trial 10 with value: 0.6058201058201058.
[I 2025-06-18 12:23:04,393] Trial 43 finished with value: 0.4833333333333333 and parameters: {'C': 11.490731735330543, 'gamma': 'scale', 'alpha': 0.4273840148945894, 'l1_ratio': 0.9601766929938376}. Best is trial 10 with value: 0.6058201058201058.
[I 2025-06-18 12:23:04,416] Trial 44 finished with value: 0.4866666666666667 and parameters: {'C': 0.7749182010509652, 'gamma': 'scale', 'alpha': 0.08300173151064387, 'l1_ratio': 0.9448997965099869}. Best is trial 10 with value: 0.6058201058201058.
[I 2025-06-18 12:23:04,447] Trial 45 finished with value: 0.5704232804232804 and parameters: {'C': 2.560633280859922, 'gamma': 'scale', 'alpha': 0.006804988972077039, 'l1_ratio': 0.7809021265390711}. Best is trial 10 with value: 0.6058201058201058.
[I 2025-06-18 12:23:04,478] Trial 46 finished with value: 0.5704232804232804 and parameters: {'C': 23.04825466477342, 'gamma': 'scale', 'alpha': 0.006838103152084958, 'l1_ratio': 0.7882272528597047}. Best is trial 10 with value: 0.6058201058201058.
[I 2025-06-18 12:23:04,504] Trial 47 finished with value: 0.5396296296296297 and parameters: {'C': 0.06841673014911391, 'gamma': 'scale', 'alpha': 0.017702898809298376, 'l1_ratio': 0.6448521070885127}. Best is trial 10 with value: 0.6058201058201058.
[I 2025-06-18 12:23:04,631] Trial 48 finished with value: 0.5396296296296297 and parameters: {'C': 2.871252701950375, 'gamma': 'scale', 'alpha': 0.000930321973972309, 'l1_ratio': 0.03799936298687026}. Best is trial 10 with value: 0.6058201058201058.
[I 2025-06-18 12:23:04,674] Trial 49 finished with value: 0.5304232804232804 and parameters: {'C': 4316.4305526849075, 'gamma': 'auto', 'alpha': 0.0021480268428462224, 'l1_ratio': 0.7492972247793177}. Best is trial 10 with value: 0.6058201058201058.
[I 2025-06-18 12:23:04,719] A new study created in memory with name: no-name-10f529af-2ae1-42cb-8917-c04b8b0f60bc
[I 2025-06-18 12:23:04,740] Trial 0 finished with value: 0.27999999999999997 and parameters: {'C': 0.14096675490461208, 'gamma': 'scale', 'alpha': 0.8448758931656905, 'l1_ratio': 0.7799758081188035}. Best is trial 0 with value: 0.27999999999999997.
[I 2025-06-18 12:23:04,759] Trial 1 finished with value: 0.27999999999999997 and parameters: {'C': 0.43207151101399793, 'gamma': 'auto', 'alpha': 6.175850414870771, 'l1_ratio': 0.8759326347420947}. Best is trial 0 with value: 0.27999999999999997.
[I 2025-06-18 12:23:04,777] Trial 2 finished with value: 0.48238095238095235 and parameters: {'C': 1.4025024214492712, 'gamma': 'auto', 'alpha': 0.3660244821898272, 'l1_ratio': 0.37025075479039493}. Best is trial 2 with value: 0.48238095238095235.
[I 2025-06-18 12:23:04,796] Trial 3 finished with value: 0.4822222222222222 and parameters: {'C': 23.29040906436821, 'gamma': 'scale', 'alpha': 0.7313632065748894, 'l1_ratio': 0.8826411906361166}. Best is trial 2 with value: 0.48238095238095235.
[I 2025-06-18 12:23:04,825] Trial 4 finished with value: 0.5795238095238096 and parameters: {'C': 1.5463788579841122, 'gamma': 'scale', 'alpha': 0.006984254077381198, 'l1_ratio': 0.9331401019825216}. Best is trial 4 with value: 0.5795238095238096.
[I 2025-06-18 12:23:04,854] Trial 5 finished with value: 0.5795238095238096 and parameters: {'C': 80.95969425082201, 'gamma': 'auto', 'alpha': 0.003838668517152234, 'l1_ratio': 0.5680986526260692}. Best is trial 4 with value: 0.5795238095238096.
[I 2025-06-18 12:23:04,906] Trial 6 finished with value: 0.6157142857142857 and parameters: {'C': 1639.6997761073915, 'gamma': 'auto', 'alpha': 0.0005234004872142785, 'l1_ratio': 0.7042609711183354}. Best is trial 6 with value: 0.6157142857142857.
[I 2025-06-18 12:23:04,927] Trial 7 finished with value: 0.49190476190476196 and parameters: {'C': 168.84486187434905, 'gamma': 'auto', 'alpha': 0.016244403817471303, 'l1_ratio': 0.9093159589724725}. Best is trial 6 with value: 0.6157142857142857.
[I 2025-06-18 12:23:04,945] Trial 8 finished with value: 0.4428571428571429 and parameters: {'C': 0.02284837598099766, 'gamma': 'scale', 'alpha': 0.23681255196123402, 'l1_ratio': 0.5946247799344488}. Best is trial 6 with value: 0.6157142857142857.
[I 2025-06-18 12:23:04,973] Trial 9 finished with value: 0.6157142857142857 and parameters: {'C': 15.843859334916775, 'gamma': 'auto', 'alpha': 0.004449817791422694, 'l1_ratio': 0.5029668331126184}. Best is trial 6 with value: 0.6157142857142857.
[I 2025-06-18 12:23:05,167] Trial 10 finished with value: 0.5207407407407407 and parameters: {'C': 5696.570441032056, 'gamma': 'auto', 'alpha': 0.00010697284975835294, 'l1_ratio': 0.0334797007385198}. Best is trial 6 with value: 0.6157142857142857.
[I 2025-06-18 12:23:05,232] Trial 11 finished with value: 0.5050793650793651 and parameters: {'C': 3164.478859325337, 'gamma': 'auto', 'alpha': 0.0005043882904132593, 'l1_ratio': 0.36817845260403653}. Best is trial 6 with value: 0.6157142857142857.
[I 2025-06-18 12:23:05,279] Trial 12 finished with value: 0.5580952380952381 and parameters: {'C': 621.2499324528844, 'gamma': 'auto', 'alpha': 0.001301071679499997, 'l1_ratio': 0.6801503816540293}. Best is trial 6 with value: 0.6157142857142857.
[I 2025-06-18 12:23:05,367] Trial 13 finished with value: 0.5750793650793651 and parameters: {'C': 6.282449788434572, 'gamma': 'auto', 'alpha': 0.0002462841830950953, 'l1_ratio': 0.3807124632972929}. Best is trial 6 with value: 0.6157142857142857.
[I 2025-06-18 12:23:05,394] Trial 14 finished with value: 0.5207407407407408 and parameters: {'C': 579.5815881520402, 'gamma': 'auto', 'alpha': 0.06032077737420916, 'l1_ratio': 0.06122050140845825}. Best is trial 6 with value: 0.6157142857142857.
[I 2025-06-18 12:23:05,444] Trial 15 finished with value: 0.5050793650793651 and parameters: {'C': 16.354220859696905, 'gamma': 'auto', 'alpha': 0.0014945105038531793, 'l1_ratio': 0.21178568602039605}. Best is trial 6 with value: 0.6157142857142857.
[I 2025-06-18 12:23:05,469] Trial 16 finished with value: 0.5355555555555556 and parameters: {'C': 1102.8706213852524, 'gamma': 'auto', 'alpha': 0.034105127731833884, 'l1_ratio': 0.699053902976435}. Best is trial 6 with value: 0.6157142857142857.
[I 2025-06-18 12:23:05,517] Trial 17 finished with value: 0.6453439153439153 and parameters: {'C': 75.29336329158762, 'gamma': 'auto', 'alpha': 0.0011621985952275538, 'l1_ratio': 0.48612283193668243}. Best is trial 17 with value: 0.6453439153439153.
[I 2025-06-18 12:23:05,580] Trial 18 finished with value: 0.5050793650793651 and parameters: {'C': 106.64415621293627, 'gamma': 'scale', 'alpha': 0.0007287635884324277, 'l1_ratio': 0.23545840851682454}. Best is trial 17 with value: 0.6453439153439153.
[I 2025-06-18 12:23:05,667] Trial 19 finished with value: 0.6017460317460317 and parameters: {'C': 2042.6499784109135, 'gamma': 'auto', 'alpha': 0.00012192493771290359, 'l1_ratio': 0.7479672446632524}. Best is trial 17 with value: 0.6453439153439153.
[I 2025-06-18 12:23:05,730] Trial 20 finished with value: 0.5712698412698413 and parameters: {'C': 8176.981543361745, 'gamma': 'auto', 'alpha': 0.0005004371518999934, 'l1_ratio': 0.5670705405767384}. Best is trial 17 with value: 0.6453439153439153.
[I 2025-06-18 12:23:05,766] Trial 21 finished with value: 0.6453439153439153 and parameters: {'C': 37.80381020801131, 'gamma': 'auto', 'alpha': 0.0033850374133371354, 'l1_ratio': 0.4621917411276455}. Best is trial 17 with value: 0.6453439153439153.
[I 2025-06-18 12:23:05,807] Trial 22 finished with value: 0.5495238095238095 and parameters: {'C': 356.1103619802848, 'gamma': 'auto', 'alpha': 0.002251960596801262, 'l1_ratio': 0.4153534244785665}. Best is trial 17 with value: 0.6453439153439153.
[I 2025-06-18 12:23:05,837] Trial 23 finished with value: 0.6157142857142857 and parameters: {'C': 53.14385313279188, 'gamma': 'auto', 'alpha': 0.009047797561459096, 'l1_ratio': 0.4747905533918465}. Best is trial 17 with value: 0.6453439153439153.
[I 2025-06-18 12:23:05,931] Trial 24 finished with value: 0.5355555555555556 and parameters: {'C': 3.000426250798042, 'gamma': 'auto', 'alpha': 0.00031037827411339647, 'l1_ratio': 0.22894191019287047}. Best is trial 17 with value: 0.6453439153439153.
[I 2025-06-18 12:23:05,975] Trial 25 finished with value: 0.5795238095238096 and parameters: {'C': 307.96186352355124, 'gamma': 'auto', 'alpha': 0.0015717633493107664, 'l1_ratio': 0.6442056703036401}. Best is trial 17 with value: 0.6453439153439153.
[I 2025-06-18 12:23:06,003] Trial 26 finished with value: 0.5476190476190477 and parameters: {'C': 40.12683527890778, 'gamma': 'scale', 'alpha': 0.01511701938422666, 'l1_ratio': 0.7985457106605752}. Best is trial 17 with value: 0.6453439153439153.
[I 2025-06-18 12:23:06,027] Trial 27 finished with value: 0.5791534391534392 and parameters: {'C': 1376.5916503831013, 'gamma': 'auto', 'alpha': 0.08947382370250863, 'l1_ratio': 0.305197685196556}. Best is trial 17 with value: 0.6453439153439153.
[I 2025-06-18 12:23:06,080] Trial 28 finished with value: 0.589047619047619 and parameters: {'C': 5.567772406606376, 'gamma': 'auto', 'alpha': 0.000903517925067604, 'l1_ratio': 0.48707051141245916}. Best is trial 17 with value: 0.6453439153439153.
[I 2025-06-18 12:23:06,117] Trial 29 finished with value: 0.48571428571428577 and parameters: {'C': 0.1906545718208273, 'gamma': 'scale', 'alpha': 0.0032564396557551306, 'l1_ratio': 0.7722272498503671}. Best is trial 17 with value: 0.6453439153439153.
[I 2025-06-18 12:23:06,187] Trial 30 finished with value: 0.5712698412698413 and parameters: {'C': 220.3611084389871, 'gamma': 'auto', 'alpha': 0.00032162495818592796, 'l1_ratio': 0.6172163508714033}. Best is trial 17 with value: 0.6453439153439153.
[I 2025-06-18 12:23:06,219] Trial 31 finished with value: 0.5795238095238096 and parameters: {'C': 13.80848648762316, 'gamma': 'auto', 'alpha': 0.0049069745057366086, 'l1_ratio': 0.5175692284102134}. Best is trial 17 with value: 0.6453439153439153.
[I 2025-06-18 12:23:06,246] Trial 32 finished with value: 0.6758201058201058 and parameters: {'C': 28.327694573599288, 'gamma': 'auto', 'alpha': 0.01630904815212796, 'l1_ratio': 0.4486042678337757}. Best is trial 32 with value: 0.6758201058201058.
[I 2025-06-18 12:23:06,270] Trial 33 finished with value: 0.4822222222222222 and parameters: {'C': 39.75996365010715, 'gamma': 'auto', 'alpha': 6.43252796293177, 'l1_ratio': 0.43547058872980215}. Best is trial 32 with value: 0.6758201058201058.
[I 2025-06-18 12:23:06,297] Trial 34 finished with value: 0.4910582010582011 and parameters: {'C': 0.5939059305783434, 'gamma': 'auto', 'alpha': 0.020795137651894446, 'l1_ratio': 0.29644453976220236}. Best is trial 32 with value: 0.6758201058201058.
[I 2025-06-18 12:23:06,320] Trial 35 finished with value: 0.549047619047619 and parameters: {'C': 3.4130990782160624, 'gamma': 'auto', 'alpha': 0.12617866920462104, 'l1_ratio': 0.8291549752735383}. Best is trial 32 with value: 0.6758201058201058.
[I 2025-06-18 12:23:06,343] Trial 36 finished with value: 0.4822222222222222 and parameters: {'C': 104.81649544634946, 'gamma': 'scale', 'alpha': 2.474444528816538, 'l1_ratio': 0.9900069142929087}. Best is trial 32 with value: 0.6758201058201058.
[I 2025-06-18 12:23:06,373] Trial 37 finished with value: 0.6157142857142857 and parameters: {'C': 1.28023221439351, 'gamma': 'auto', 'alpha': 0.008364890377231812, 'l1_ratio': 0.532080087776066}. Best is trial 32 with value: 0.6758201058201058.
[I 2025-06-18 12:23:06,398] Trial 38 finished with value: 0.6091534391534392 and parameters: {'C': 24.236924777549675, 'gamma': 'auto', 'alpha': 0.04365204377015641, 'l1_ratio': 0.4454730479068535}. Best is trial 32 with value: 0.6758201058201058.
[I 2025-06-18 12:23:06,436] Trial 39 finished with value: 0.5000000000000001 and parameters: {'C': 0.020968689138915707, 'gamma': 'scale', 'alpha': 0.002787831825489485, 'l1_ratio': 0.31514250421563983}. Best is trial 32 with value: 0.6758201058201058.
[I 2025-06-18 12:23:06,464] Trial 40 finished with value: 0.6157142857142857 and parameters: {'C': 140.59432729653437, 'gamma': 'auto', 'alpha': 0.011597660199983834, 'l1_ratio': 0.5704894960056511}. Best is trial 32 with value: 0.6758201058201058.
[I 2025-06-18 12:23:06,496] Trial 41 finished with value: 0.5795238095238096 and parameters: {'C': 7.791321835775618, 'gamma': 'auto', 'alpha': 0.005532116466887222, 'l1_ratio': 0.52510959617426}. Best is trial 32 with value: 0.6758201058201058.
[I 2025-06-18 12:23:06,523] Trial 42 finished with value: 0.6096296296296296 and parameters: {'C': 26.662170430858364, 'gamma': 'auto', 'alpha': 0.02216028292106549, 'l1_ratio': 0.38827082287534936}. Best is trial 32 with value: 0.6758201058201058.
[I 2025-06-18 12:23:06,575] Trial 43 finished with value: 0.6157142857142857 and parameters: {'C': 60.076432412667806, 'gamma': 'auto', 'alpha': 0.0007853759876461938, 'l1_ratio': 0.6628032132344354}. Best is trial 32 with value: 0.6758201058201058.
[I 2025-06-18 12:23:06,616] Trial 44 finished with value: 0.5580952380952381 and parameters: {'C': 12.853112425592043, 'gamma': 'auto', 'alpha': 0.0023406240105525115, 'l1_ratio': 0.7258953066059993}. Best is trial 32 with value: 0.6758201058201058.
[I 2025-06-18 12:23:06,711] Trial 45 finished with value: 0.6017460317460317 and parameters: {'C': 2.229423398781363, 'gamma': 'auto', 'alpha': 0.00017681197353319465, 'l1_ratio': 0.4743614205047036}. Best is trial 32 with value: 0.6758201058201058.
[I 2025-06-18 12:23:06,745] Trial 46 finished with value: 0.6157142857142857 and parameters: {'C': 3682.539383913077, 'gamma': 'auto', 'alpha': 0.00467456907607867, 'l1_ratio': 0.6193557947524919}. Best is trial 32 with value: 0.6758201058201058.
[I 2025-06-18 12:23:06,794] Trial 47 finished with value: 0.5050793650793651 and parameters: {'C': 484.476766239697, 'gamma': 'auto', 'alpha': 0.0012428904128079094, 'l1_ratio': 0.35599293404626065}. Best is trial 32 with value: 0.6758201058201058.
[I 2025-06-18 12:23:06,853] Trial 48 finished with value: 0.5712698412698413 and parameters: {'C': 854.5048042739332, 'gamma': 'auto', 'alpha': 0.0005841247817854194, 'l1_ratio': 0.554834134535665}. Best is trial 32 with value: 0.6758201058201058.
