Error in cpuinfo: prctl(PR_SVE_GET_VL) failed
[I 2025-06-18 12:22:55,421] A new study created in memory with name: no-name-ae76c362-5143-4409-9ca9-cb3c59ef4a19
[I 2025-06-18 12:22:55,537] Trial 0 finished with value: 0.3003174603174603 and parameters: {'C': 0.14096675490461208, 'gamma': 'scale', 'alpha': 0.8448758931656905, 'l1_ratio': 0.7799758081188035}. Best is trial 0 with value: 0.3003174603174603.
[I 2025-06-18 12:22:55,557] Trial 1 finished with value: 0.3003174603174603 and parameters: {'C': 0.43207151101399793, 'gamma': 'auto', 'alpha': 6.175850414870771, 'l1_ratio': 0.8759326347420947}. Best is trial 0 with value: 0.3003174603174603.
[I 2025-06-18 12:22:55,575] Trial 2 finished with value: 0.552010582010582 and parameters: {'C': 1.4025024214492712, 'gamma': 'auto', 'alpha': 0.3660244821898272, 'l1_ratio': 0.37025075479039493}. Best is trial 2 with value: 0.552010582010582.
[I 2025-06-18 12:22:55,594] Trial 3 finished with value: 0.4955555555555556 and parameters: {'C': 23.29040906436821, 'gamma': 'scale', 'alpha': 0.7313632065748894, 'l1_ratio': 0.8826411906361166}. Best is trial 2 with value: 0.552010582010582.
[I 2025-06-18 12:22:55,621] Trial 4 finished with value: 0.6285714285714284 and parameters: {'C': 1.5463788579841122, 'gamma': 'scale', 'alpha': 0.006984254077381198, 'l1_ratio': 0.9331401019825216}. Best is trial 4 with value: 0.6285714285714284.
[I 2025-06-18 12:22:55,654] Trial 5 finished with value: 0.5742328042328042 and parameters: {'C': 80.95969425082201, 'gamma': 'auto', 'alpha': 0.003838668517152234, 'l1_ratio': 0.5680986526260692}. Best is trial 4 with value: 0.6285714285714284.
[I 2025-06-18 12:22:55,715] Trial 6 finished with value: 0.5920105820105821 and parameters: {'C': 1639.6997761073915, 'gamma': 'auto', 'alpha': 0.0005234004872142785, 'l1_ratio': 0.7042609711183354}. Best is trial 4 with value: 0.6285714285714284.
[I 2025-06-18 12:22:55,740] Trial 7 finished with value: 0.6107936507936508 and parameters: {'C': 168.84486187434905, 'gamma': 'auto', 'alpha': 0.016244403817471303, 'l1_ratio': 0.9093159589724725}. Best is trial 4 with value: 0.6285714285714284.
[I 2025-06-18 12:22:55,759] Trial 8 finished with value: 0.6404761904761905 and parameters: {'C': 0.02284837598099766, 'gamma': 'scale', 'alpha': 0.23681255196123402, 'l1_ratio': 0.5946247799344488}. Best is trial 8 with value: 0.6404761904761905.
[I 2025-06-18 12:22:55,791] Trial 9 finished with value: 0.5742328042328042 and parameters: {'C': 15.843859334916775, 'gamma': 'auto', 'alpha': 0.004449817791422694, 'l1_ratio': 0.5029668331126184}. Best is trial 8 with value: 0.6404761904761905.
[I 2025-06-18 12:22:55,820] Trial 10 finished with value: 0.3003174603174603 and parameters: {'C': 0.014292925160013454, 'gamma': 'scale', 'alpha': 0.0947522411997392, 'l1_ratio': 0.0334797007385198}. Best is trial 8 with value: 0.6404761904761905.
[I 2025-06-18 12:22:55,938] Trial 11 finished with value: 0.28253968253968254 and parameters: {'C': 0.012520167908906137, 'gamma': 'scale', 'alpha': 0.00019073042216078507, 'l1_ratio': 0.2742018269814582}. Best is trial 8 with value: 0.6404761904761905.
[I 2025-06-18 12:22:55,963] Trial 12 finished with value: 0.7136507936507936 and parameters: {'C': 1.8677634799350311, 'gamma': 'scale', 'alpha': 0.040820932110129035, 'l1_ratio': 0.6621611763948015}. Best is trial 12 with value: 0.7136507936507936.
[I 2025-06-18 12:22:55,986] Trial 13 finished with value: 0.5003174603174603 and parameters: {'C': 0.09874279361786556, 'gamma': 'scale', 'alpha': 0.0975243323260206, 'l1_ratio': 0.6459624252649727}. Best is trial 12 with value: 0.7136507936507936.
[I 2025-06-18 12:22:56,010] Trial 14 finished with value: 0.4955555555555556 and parameters: {'C': 7714.4730414127025, 'gamma': 'scale', 'alpha': 9.468589320386773, 'l1_ratio': 0.36959836328010715}. Best is trial 12 with value: 0.7136507936507936.
[I 2025-06-18 12:22:56,033] Trial 15 finished with value: 0.6774603174603173 and parameters: {'C': 2.7937082411810152, 'gamma': 'scale', 'alpha': 0.05114951056691116, 'l1_ratio': 0.6169536669564266}. Best is trial 12 with value: 0.7136507936507936.
[I 2025-06-18 12:22:56,058] Trial 16 finished with value: 0.6404232804232803 and parameters: {'C': 2.9521403001774114, 'gamma': 'scale', 'alpha': 0.034105127731833884, 'l1_ratio': 0.77745609521756}. Best is trial 12 with value: 0.7136507936507936.
[I 2025-06-18 12:22:56,115] Trial 17 finished with value: 0.5446031746031746 and parameters: {'C': 5.979569909767081, 'gamma': 'scale', 'alpha': 0.0011071682119287145, 'l1_ratio': 0.4248915716322913}. Best is trial 12 with value: 0.7136507936507936.
[I 2025-06-18 12:22:56,141] Trial 18 finished with value: 0.5179365079365079 and parameters: {'C': 250.73082524554997, 'gamma': 'scale', 'alpha': 0.03576742486001985, 'l1_ratio': 0.20223488340315876}. Best is trial 12 with value: 0.7136507936507936.
[I 2025-06-18 12:22:56,164] Trial 19 finished with value: 0.3888888888888889 and parameters: {'C': 0.4144005186058057, 'gamma': 'scale', 'alpha': 1.9813428178274526, 'l1_ratio': 0.5128209147488255}. Best is trial 12 with value: 0.7136507936507936.
[I 2025-06-18 12:22:56,188] Trial 20 finished with value: 0.6552380952380952 and parameters: {'C': 40.99771332765144, 'gamma': 'scale', 'alpha': 0.10058096214432248, 'l1_ratio': 0.7040451063786317}. Best is trial 12 with value: 0.7136507936507936.
[I 2025-06-18 12:22:56,211] Trial 21 finished with value: 0.6112698412698412 and parameters: {'C': 37.62827968405027, 'gamma': 'scale', 'alpha': 0.12013373746865447, 'l1_ratio': 0.7190353756622123}. Best is trial 12 with value: 0.7136507936507936.
[I 2025-06-18 12:22:56,237] Trial 22 finished with value: 0.6404232804232803 and parameters: {'C': 7.441569706934928, 'gamma': 'scale', 'alpha': 0.015508823231734921, 'l1_ratio': 0.6589184808124118}. Best is trial 12 with value: 0.7136507936507936.
[I 2025-06-18 12:22:56,261] Trial 23 finished with value: 0.6112698412698412 and parameters: {'C': 427.1584216728282, 'gamma': 'scale', 'alpha': 0.06896512617051474, 'l1_ratio': 0.7593534431114538}. Best is trial 12 with value: 0.7136507936507936.
[I 2025-06-18 12:22:56,289] Trial 24 finished with value: 0.6404232804232803 and parameters: {'C': 0.5828465033998523, 'gamma': 'scale', 'alpha': 0.013348346607852486, 'l1_ratio': 0.605297058610775}. Best is trial 12 with value: 0.7136507936507936.
[I 2025-06-18 12:22:56,312] Trial 25 finished with value: 0.5742328042328042 and parameters: {'C': 7.15044768250222, 'gamma': 'scale', 'alpha': 0.26813592078516413, 'l1_ratio': 0.45053106843377455}. Best is trial 12 with value: 0.7136507936507936.
[I 2025-06-18 12:22:56,336] Trial 26 finished with value: 0.6774603174603173 and parameters: {'C': 55.464366279725205, 'gamma': 'scale', 'alpha': 0.04708788040143567, 'l1_ratio': 0.8378920865087907}. Best is trial 12 with value: 0.7136507936507936.
[I 2025-06-18 12:22:56,380] Trial 27 finished with value: 0.6019047619047619 and parameters: {'C': 2.369625074387549, 'gamma': 'scale', 'alpha': 0.0019453463554903996, 'l1_ratio': 0.840790033866808}. Best is trial 12 with value: 0.7136507936507936.
[I 2025-06-18 12:22:56,406] Trial 28 finished with value: 0.5219047619047619 and parameters: {'C': 0.10197261530070537, 'gamma': 'scale', 'alpha': 0.044871028560843615, 'l1_ratio': 0.9983266847114767}. Best is trial 12 with value: 0.7136507936507936.
[I 2025-06-18 12:22:56,434] Trial 29 finished with value: 0.4955555555555556 and parameters: {'C': 957.0801916225877, 'gamma': 'scale', 'alpha': 0.8515574153412147, 'l1_ratio': 0.8172523408595793}. Best is trial 12 with value: 0.7136507936507936.
[I 2025-06-18 12:22:56,464] Trial 30 finished with value: 0.6285714285714284 and parameters: {'C': 70.00261727562653, 'gamma': 'scale', 'alpha': 0.010718254300633182, 'l1_ratio': 0.7957138780364461}. Best is trial 12 with value: 0.7136507936507936.
[I 2025-06-18 12:22:56,489] Trial 31 finished with value: 0.566031746031746 and parameters: {'C': 52.982044259922844, 'gamma': 'scale', 'alpha': 0.1739791285560579, 'l1_ratio': 0.6992110083426571}. Best is trial 12 with value: 0.7136507936507936.
[I 2025-06-18 12:22:56,514] Trial 32 finished with value: 0.6107936507936508 and parameters: {'C': 15.116236972267243, 'gamma': 'scale', 'alpha': 0.03046801019108166, 'l1_ratio': 0.5555908726217834}. Best is trial 12 with value: 0.7136507936507936.
[I 2025-06-18 12:22:56,538] Trial 33 finished with value: 0.6222222222222221 and parameters: {'C': 0.4594041672999204, 'gamma': 'scale', 'alpha': 0.4677560400506583, 'l1_ratio': 0.6547771662486397}. Best is trial 12 with value: 0.7136507936507936.
[I 2025-06-18 12:22:56,562] Trial 34 finished with value: 0.4955555555555556 and parameters: {'C': 3.1598434543032137, 'gamma': 'auto', 'alpha': 1.910262327935349, 'l1_ratio': 0.7417655837034364}. Best is trial 12 with value: 0.7136507936507936.
[I 2025-06-18 12:22:56,586] Trial 35 finished with value: 0.6774603174603173 and parameters: {'C': 0.8138067014954881, 'gamma': 'scale', 'alpha': 0.0526384884554412, 'l1_ratio': 0.9643269109592181}. Best is trial 12 with value: 0.7136507936507936.
[I 2025-06-18 12:22:56,611] Trial 36 finished with value: 0.6107936507936508 and parameters: {'C': 1.0209257289111162, 'gamma': 'scale', 'alpha': 0.024127871647866582, 'l1_ratio': 0.9812117089151656}. Best is trial 12 with value: 0.7136507936507936.
[I 2025-06-18 12:22:56,642] Trial 37 finished with value: 0.2812698412698413 and parameters: {'C': 0.2785006523936751, 'gamma': 'auto', 'alpha': 0.008536646748296038, 'l1_ratio': 0.886210264175182}. Best is trial 12 with value: 0.7136507936507936.
[I 2025-06-18 12:22:56,667] Trial 38 finished with value: 0.4685714285714286 and parameters: {'C': 0.169215088077254, 'gamma': 'scale', 'alpha': 0.047806615023949506, 'l1_ratio': 0.9332707481187897}. Best is trial 12 with value: 0.7136507936507936.
[I 2025-06-18 12:22:56,698] Trial 39 finished with value: 0.6019047619047619 and parameters: {'C': 0.9556066028273554, 'gamma': 'auto', 'alpha': 0.005366390644767056, 'l1_ratio': 0.8492114841760146}. Best is trial 12 with value: 0.7136507936507936.
[I 2025-06-18 12:22:56,738] Trial 40 finished with value: 0.5623809523809523 and parameters: {'C': 1.479357896415402, 'gamma': 'scale', 'alpha': 0.0024604256896119006, 'l1_ratio': 0.9633543586604456}. Best is trial 12 with value: 0.7136507936507936.
[I 2025-06-18 12:22:56,762] Trial 41 finished with value: 0.596031746031746 and parameters: {'C': 29.001941610490327, 'gamma': 'scale', 'alpha': 0.15654207337909298, 'l1_ratio': 0.8793840553123613}. Best is trial 12 with value: 0.7136507936507936.
[I 2025-06-18 12:22:56,786] Trial 42 finished with value: 0.6112698412698412 and parameters: {'C': 155.87741469270998, 'gamma': 'scale', 'alpha': 0.06675863087900163, 'l1_ratio': 0.6285717333575499}. Best is trial 12 with value: 0.7136507936507936.
[I 2025-06-18 12:22:56,810] Trial 43 finished with value: 0.44000000000000006 and parameters: {'C': 0.04765758092673296, 'gamma': 'scale', 'alpha': 0.4601026603985203, 'l1_ratio': 0.5740827703861406}. Best is trial 12 with value: 0.7136507936507936.
[I 2025-06-18 12:22:56,835] Trial 44 finished with value: 0.6112698412698412 and parameters: {'C': 18.63801872664942, 'gamma': 'scale', 'alpha': 0.07703106377876355, 'l1_ratio': 0.6802862245160637}. Best is trial 12 with value: 0.7136507936507936.
[I 2025-06-18 12:22:56,860] Trial 45 finished with value: 0.6107936507936508 and parameters: {'C': 10.56048861388408, 'gamma': 'auto', 'alpha': 0.02170232949546763, 'l1_ratio': 0.9277701834636709}. Best is trial 12 with value: 0.7136507936507936.
[I 2025-06-18 12:22:56,883] Trial 46 finished with value: 0.7904761904761906 and parameters: {'C': 4.584365931234944, 'gamma': 'scale', 'alpha': 0.23960512305437456, 'l1_ratio': 0.8030332301663589}. Best is trial 46 with value: 0.7904761904761906.
[I 2025-06-18 12:22:56,907] Trial 47 finished with value: 0.6622222222222222 and parameters: {'C': 3.9429845528172254, 'gamma': 'scale', 'alpha': 0.19019558913597712, 'l1_ratio': 0.8506423057941827}. Best is trial 46 with value: 0.7904761904761906.
[I 2025-06-18 12:22:56,931] Trial 48 finished with value: 0.4955555555555556 and parameters: {'C': 2.0710750056795373, 'gamma': 'scale', 'alpha': 0.9288674341209305, 'l1_ratio': 0.7895495949791179}. Best is trial 46 with value: 0.7904761904761906.
[I 2025-06-18 12:22:56,954] Trial 49 finished with value: 0.7904761904761906 and parameters: {'C': 4.666211009746551, 'gamma': 'scale', 'alpha': 0.33813118716878277, 'l1_ratio': 0.736001020153647}. Best is trial 46 with value: 0.7904761904761906.
[I 2025-06-18 12:22:56,959] A new study created in memory with name: no-name-3a67ed45-a2b4-49bc-8733-04cb7ee94e8c
[I 2025-06-18 12:22:56,978] Trial 0 finished with value: 0.3180952380952381 and parameters: {'C': 0.14096675490461208, 'gamma': 'scale', 'alpha': 0.8448758931656905, 'l1_ratio': 0.7799758081188035}. Best is trial 0 with value: 0.3180952380952381.
[I 2025-06-18 12:22:56,997] Trial 1 finished with value: 0.2723809523809524 and parameters: {'C': 0.43207151101399793, 'gamma': 'auto', 'alpha': 6.175850414870771, 'l1_ratio': 0.8759326347420947}. Best is trial 0 with value: 0.3180952380952381.
[I 2025-06-18 12:22:57,015] Trial 2 finished with value: 0.39841269841269844 and parameters: {'C': 1.4025024214492712, 'gamma': 'auto', 'alpha': 0.3660244821898272, 'l1_ratio': 0.37025075479039493}. Best is trial 2 with value: 0.39841269841269844.
[I 2025-06-18 12:22:57,034] Trial 3 finished with value: 0.5719047619047619 and parameters: {'C': 23.29040906436821, 'gamma': 'scale', 'alpha': 0.7313632065748894, 'l1_ratio': 0.8826411906361166}. Best is trial 3 with value: 0.5719047619047619.
[I 2025-06-18 12:22:57,058] Trial 4 finished with value: 0.5441269841269841 and parameters: {'C': 1.5463788579841122, 'gamma': 'scale', 'alpha': 0.006984254077381198, 'l1_ratio': 0.9331401019825216}. Best is trial 3 with value: 0.5719047619047619.
[I 2025-06-18 12:22:57,087] Trial 5 finished with value: 0.6107936507936509 and parameters: {'C': 80.95969425082201, 'gamma': 'auto', 'alpha': 0.003838668517152234, 'l1_ratio': 0.5680986526260692}. Best is trial 5 with value: 0.6107936507936509.
[I 2025-06-18 12:22:57,133] Trial 6 finished with value: 0.6195238095238095 and parameters: {'C': 1639.6997761073915, 'gamma': 'auto', 'alpha': 0.0005234004872142785, 'l1_ratio': 0.7042609711183354}. Best is trial 6 with value: 0.6195238095238095.
[I 2025-06-18 12:22:57,154] Trial 7 finished with value: 0.5619047619047619 and parameters: {'C': 168.84486187434905, 'gamma': 'auto', 'alpha': 0.016244403817471303, 'l1_ratio': 0.9093159589724725}. Best is trial 6 with value: 0.6195238095238095.
[I 2025-06-18 12:22:57,173] Trial 8 finished with value: 0.27746031746031746 and parameters: {'C': 0.02284837598099766, 'gamma': 'scale', 'alpha': 0.23681255196123402, 'l1_ratio': 0.5946247799344488}. Best is trial 6 with value: 0.6195238095238095.
[I 2025-06-18 12:22:57,201] Trial 9 finished with value: 0.6285714285714286 and parameters: {'C': 15.843859334916775, 'gamma': 'auto', 'alpha': 0.004449817791422694, 'l1_ratio': 0.5029668331126184}. Best is trial 9 with value: 0.6285714285714286.
[I 2025-06-18 12:22:57,412] Trial 10 finished with value: 0.5326984126984127 and parameters: {'C': 3303.1968883340887, 'gamma': 'auto', 'alpha': 0.00011251913673839628, 'l1_ratio': 0.0334797007385198}. Best is trial 9 with value: 0.6285714285714286.
[I 2025-06-18 12:22:57,483] Trial 11 finished with value: 0.6496296296296296 and parameters: {'C': 6617.652148921523, 'gamma': 'auto', 'alpha': 0.0005043882904132593, 'l1_ratio': 0.36817845260403653}. Best is trial 11 with value: 0.6496296296296296.
[I 2025-06-18 12:22:57,541] Trial 12 finished with value: 0.6022222222222222 and parameters: {'C': 648.3093753578262, 'gamma': 'auto', 'alpha': 0.0008733233221374762, 'l1_ratio': 0.3274694219933409}. Best is trial 11 with value: 0.6496296296296296.
[I 2025-06-18 12:22:57,591] Trial 13 finished with value: 0.6022222222222222 and parameters: {'C': 9147.715120374, 'gamma': 'auto', 'alpha': 0.001419306226379376, 'l1_ratio': 0.2971268688509032}. Best is trial 11 with value: 0.6496296296296296.
[I 2025-06-18 12:22:57,752] Trial 14 finished with value: 0.5771428571428572 and parameters: {'C': 8.625075403227028, 'gamma': 'auto', 'alpha': 0.00010400561117852953, 'l1_ratio': 0.13487719318738955}. Best is trial 11 with value: 0.6496296296296296.
[I 2025-06-18 12:22:57,777] Trial 15 finished with value: 0.6404232804232804 and parameters: {'C': 267.43506115361595, 'gamma': 'auto', 'alpha': 0.04315245342668531, 'l1_ratio': 0.45039164404215504}. Best is trial 11 with value: 0.6496296296296296.
[I 2025-06-18 12:22:57,803] Trial 16 finished with value: 0.6582010582010582 and parameters: {'C': 257.4145641284966, 'gamma': 'auto', 'alpha': 0.0665855469180033, 'l1_ratio': 0.2104240137360589}. Best is trial 16 with value: 0.6582010582010582.
[I 2025-06-18 12:22:57,828] Trial 17 finished with value: 0.6282010582010582 and parameters: {'C': 9522.560167966754, 'gamma': 'auto', 'alpha': 0.049158354174471404, 'l1_ratio': 0.19211973544897187}. Best is trial 16 with value: 0.6582010582010582.
[I 2025-06-18 12:22:57,853] Trial 18 finished with value: 0.6067724867724869 and parameters: {'C': 851.1146410416354, 'gamma': 'scale', 'alpha': 0.10688207228432492, 'l1_ratio': 0.20109568620336332}. Best is trial 16 with value: 0.6582010582010582.
[I 2025-06-18 12:22:57,876] Trial 19 finished with value: 0.5541269841269841 and parameters: {'C': 101.81525530924189, 'gamma': 'auto', 'alpha': 4.589356505822169, 'l1_ratio': 0.02383912324755838}. Best is trial 16 with value: 0.6582010582010582.
[I 2025-06-18 12:22:57,903] Trial 20 finished with value: 0.6285714285714286 and parameters: {'C': 1906.5622205527209, 'gamma': 'auto', 'alpha': 0.013790896775273445, 'l1_ratio': 0.4146082162578849}. Best is trial 16 with value: 0.6582010582010582.
[I 2025-06-18 12:22:57,941] Trial 21 finished with value: 0.5803174603174603 and parameters: {'C': 236.435184715696, 'gamma': 'auto', 'alpha': 0.04427498935641481, 'l1_ratio': 0.4464688983622889}. Best is trial 16 with value: 0.6582010582010582.
[I 2025-06-18 12:22:57,990] Trial 22 finished with value: 0.5619047619047619 and parameters: {'C': 48.079765811694465, 'gamma': 'auto', 'alpha': 0.14246911576931054, 'l1_ratio': 0.2578834829905055}. Best is trial 16 with value: 0.6582010582010582.
[I 2025-06-18 12:22:58,023] Trial 23 finished with value: 0.5803174603174603 and parameters: {'C': 284.39650328291407, 'gamma': 'auto', 'alpha': 0.0483158656063881, 'l1_ratio': 0.5077851242935784}. Best is trial 16 with value: 0.6582010582010582.
[I 2025-06-18 12:22:58,054] Trial 24 finished with value: 0.6282010582010582 and parameters: {'C': 4.642765188861077, 'gamma': 'auto', 'alpha': 0.013348346607852486, 'l1_ratio': 0.17580589097443552}. Best is trial 16 with value: 0.6582010582010582.
[I 2025-06-18 12:22:58,081] Trial 25 finished with value: 0.5719047619047619 and parameters: {'C': 582.1570022845442, 'gamma': 'auto', 'alpha': 2.029614209692302, 'l1_ratio': 0.6183829546765152}. Best is trial 16 with value: 0.6582010582010582.
[I 2025-06-18 12:22:58,240] Trial 26 finished with value: 0.5755555555555556 and parameters: {'C': 3772.9701215950386, 'gamma': 'scale', 'alpha': 0.0003170856583208487, 'l1_ratio': 0.08407237840430126}. Best is trial 16 with value: 0.6582010582010582.
[I 2025-06-18 12:22:58,283] Trial 27 finished with value: 0.5717460317460317 and parameters: {'C': 413.1077590174004, 'gamma': 'auto', 'alpha': 0.0025619315978647472, 'l1_ratio': 0.2649649874968092}. Best is trial 16 with value: 0.6582010582010582.
[I 2025-06-18 12:22:58,312] Trial 28 finished with value: 0.6107936507936509 and parameters: {'C': 41.23422144958611, 'gamma': 'auto', 'alpha': 0.02839192805144449, 'l1_ratio': 0.4220485662533173}. Best is trial 16 with value: 0.6582010582010582.
[I 2025-06-18 12:22:58,338] Trial 29 finished with value: 0.45714285714285713 and parameters: {'C': 1750.6749719615614, 'gamma': 'scale', 'alpha': 0.10855378035211541, 'l1_ratio': 0.6798597489941589}. Best is trial 16 with value: 0.6582010582010582.
[I 2025-06-18 12:22:58,365] Trial 30 finished with value: 0.5355555555555556 and parameters: {'C': 0.013026267284721707, 'gamma': 'auto', 'alpha': 0.9925653812484865, 'l1_ratio': 0.34723562451549705}. Best is trial 16 with value: 0.6582010582010582.
[I 2025-06-18 12:22:58,400] Trial 31 finished with value: 0.6285714285714286 and parameters: {'C': 16.238371462906358, 'gamma': 'auto', 'alpha': 0.006458628087057997, 'l1_ratio': 0.4831981184308508}. Best is trial 16 with value: 0.6582010582010582.
[I 2025-06-18 12:22:58,444] Trial 32 finished with value: 0.32698412698412704 and parameters: {'C': 0.13505167374933263, 'gamma': 'auto', 'alpha': 0.0016589328358135927, 'l1_ratio': 0.5231376692327182}. Best is trial 16 with value: 0.6582010582010582.
[I 2025-06-18 12:22:58,477] Trial 33 finished with value: 0.6107936507936509 and parameters: {'C': 3.7724423976103143, 'gamma': 'auto', 'alpha': 0.005635636533753212, 'l1_ratio': 0.3772908417147629}. Best is trial 16 with value: 0.6582010582010582.
[I 2025-06-18 12:22:58,554] Trial 34 finished with value: 0.34888888888888886 and parameters: {'C': 0.44907304852243224, 'gamma': 'auto', 'alpha': 0.0002607595165997314, 'l1_ratio': 0.6930738886803864}. Best is trial 16 with value: 0.6582010582010582.
[I 2025-06-18 12:22:58,581] Trial 35 finished with value: 0.6107936507936509 and parameters: {'C': 31.091249352339243, 'gamma': 'auto', 'alpha': 0.022886220511547564, 'l1_ratio': 0.45370811376224013}. Best is trial 16 with value: 0.6582010582010582.
[I 2025-06-18 12:22:58,605] Trial 36 finished with value: 0.4171428571428571 and parameters: {'C': 92.51001921549758, 'gamma': 'scale', 'alpha': 0.35567153783613425, 'l1_ratio': 0.5446763493081375}. Best is trial 16 with value: 0.6582010582010582.
