[I 2025-06-18 12:22:58,640] Trial 37 finished with value: 0.6285714285714286 and parameters: {'C': 10.303046612389787, 'gamma': 'auto', 'alpha': 0.00337000358414577, 'l1_ratio': 0.37964856007046777}. Best is trial 16 with value: 0.6582010582010582.
[I 2025-06-18 12:22:58,665] Trial 38 finished with value: 0.6857142857142857 and parameters: {'C': 1.3724461061244833, 'gamma': 'auto', 'alpha': 0.07395842634785031, 'l1_ratio': 0.6345309720786997}. Best is trial 38 with value: 0.6857142857142857.
[I 2025-06-18 12:22:58,689] Trial 39 finished with value: 0.5219047619047619 and parameters: {'C': 0.8930575744726439, 'gamma': 'auto', 'alpha': 0.07608920460720217, 'l1_ratio': 0.7759883709172951}. Best is trial 38 with value: 0.6857142857142857.
[I 2025-06-18 12:22:58,713] Trial 40 finished with value: 0.43619047619047613 and parameters: {'C': 0.21631585689928737, 'gamma': 'scale', 'alpha': 0.27426241491408754, 'l1_ratio': 0.8231432949886273}. Best is trial 38 with value: 0.6857142857142857.
[I 2025-06-18 12:22:58,741] Trial 41 finished with value: 0.5980952380952381 and parameters: {'C': 2.4038398735509188, 'gamma': 'auto', 'alpha': 0.010809622662083221, 'l1_ratio': 0.619733105106516}. Best is trial 38 with value: 0.6857142857142857.
[I 2025-06-18 12:22:58,766] Trial 42 finished with value: 0.4171428571428571 and parameters: {'C': 1.0361674456888976, 'gamma': 'auto', 'alpha': 0.16591264432779296, 'l1_ratio': 0.4792198837335555}. Best is trial 38 with value: 0.6857142857142857.
[I 2025-06-18 12:22:58,792] Trial 43 finished with value: 0.5719047619047619 and parameters: {'C': 4326.258074965162, 'gamma': 'auto', 'alpha': 0.5325322588386991, 'l1_ratio': 0.5713586829457988}. Best is trial 38 with value: 0.6857142857142857.
[I 2025-06-18 12:22:58,844] Trial 44 finished with value: 0.6195238095238095 and parameters: {'C': 144.4772117567496, 'gamma': 'auto', 'alpha': 0.0005339462452232988, 'l1_ratio': 0.6444062188931475}. Best is trial 38 with value: 0.6857142857142857.
[I 2025-06-18 12:22:58,868] Trial 45 finished with value: 0.34888888888888886 and parameters: {'C': 0.07038139146937678, 'gamma': 'auto', 'alpha': 0.07077282611664772, 'l1_ratio': 0.734351887137363}. Best is trial 38 with value: 0.6857142857142857.
[I 2025-06-18 12:22:58,895] Trial 46 finished with value: 0.6404232804232804 and parameters: {'C': 1072.2872807431888, 'gamma': 'auto', 'alpha': 0.027154238084011097, 'l1_ratio': 0.29213462762008485}. Best is trial 38 with value: 0.6857142857142857.
[I 2025-06-18 12:22:58,924] Trial 47 finished with value: 0.6104232804232804 and parameters: {'C': 1463.6592337884902, 'gamma': 'auto', 'alpha': 0.02553040049486166, 'l1_ratio': 0.2602382147437749}. Best is trial 38 with value: 0.6857142857142857.
[I 2025-06-18 12:22:58,947] Trial 48 finished with value: 0.5580952380952381 and parameters: {'C': 888.9553180142309, 'gamma': 'auto', 'alpha': 0.18605052838128883, 'l1_ratio': 0.31099821462578964}. Best is trial 38 with value: 0.6857142857142857.
[I 2025-06-18 12:22:58,972] Trial 49 finished with value: 0.6285714285714286 and parameters: {'C': 4252.548234671028, 'gamma': 'auto', 'alpha': 0.7919590440953956, 'l1_ratio': 0.10878094785124981}. Best is trial 38 with value: 0.6857142857142857.
[I 2025-06-18 12:22:58,978] A new study created in memory with name: no-name-bfa7c792-e175-4d4c-b1fe-0261fe20e966
[I 2025-06-18 12:22:58,999] Trial 0 finished with value: 0.2038095238095238 and parameters: {'C': 0.14096675490461208, 'gamma': 'scale', 'alpha': 0.8448758931656905, 'l1_ratio': 0.7799758081188035}. Best is trial 0 with value: 0.2038095238095238.
[I 2025-06-18 12:22:59,018] Trial 1 finished with value: 0.3504761904761905 and parameters: {'C': 0.43207151101399793, 'gamma': 'auto', 'alpha': 6.175850414870771, 'l1_ratio': 0.8759326347420947}. Best is trial 1 with value: 0.3504761904761905.
[I 2025-06-18 12:22:59,040] Trial 2 finished with value: 0.5418518518518518 and parameters: {'C': 1.4025024214492712, 'gamma': 'auto', 'alpha': 0.3660244821898272, 'l1_ratio': 0.37025075479039493}. Best is trial 2 with value: 0.5418518518518518.
[I 2025-06-18 12:22:59,060] Trial 3 finished with value: 0.5133333333333333 and parameters: {'C': 23.29040906436821, 'gamma': 'scale', 'alpha': 0.7313632065748894, 'l1_ratio': 0.8826411906361166}. Best is trial 2 with value: 0.5418518518518518.
[I 2025-06-18 12:22:59,088] Trial 4 finished with value: 0.44486772486772486 and parameters: {'C': 1.5463788579841122, 'gamma': 'scale', 'alpha': 0.006984254077381198, 'l1_ratio': 0.9331401019825216}. Best is trial 2 with value: 0.5418518518518518.
[I 2025-06-18 12:22:59,118] Trial 5 finished with value: 0.5896296296296296 and parameters: {'C': 80.95969425082201, 'gamma': 'auto', 'alpha': 0.003838668517152234, 'l1_ratio': 0.5680986526260692}. Best is trial 5 with value: 0.5896296296296296.
[I 2025-06-18 12:22:59,176] Trial 6 finished with value: 0.5096296296296295 and parameters: {'C': 1639.6997761073915, 'gamma': 'auto', 'alpha': 0.0005234004872142785, 'l1_ratio': 0.7042609711183354}. Best is trial 5 with value: 0.5896296296296296.
[I 2025-06-18 12:22:59,198] Trial 7 finished with value: 0.4666666666666666 and parameters: {'C': 168.84486187434905, 'gamma': 'auto', 'alpha': 0.016244403817471303, 'l1_ratio': 0.9093159589724725}. Best is trial 5 with value: 0.5896296296296296.
[I 2025-06-18 12:22:59,217] Trial 8 finished with value: 0.44761904761904764 and parameters: {'C': 0.02284837598099766, 'gamma': 'scale', 'alpha': 0.23681255196123402, 'l1_ratio': 0.5946247799344488}. Best is trial 5 with value: 0.5896296296296296.
[I 2025-06-18 12:22:59,247] Trial 9 finished with value: 0.6077248677248678 and parameters: {'C': 15.843859334916775, 'gamma': 'auto', 'alpha': 0.004449817791422694, 'l1_ratio': 0.5029668331126184}. Best is trial 9 with value: 0.6077248677248678.
[I 2025-06-18 12:22:59,425] Trial 10 finished with value: 0.4333333333333333 and parameters: {'C': 3303.1968883340887, 'gamma': 'auto', 'alpha': 0.00011251913673839628, 'l1_ratio': 0.0334797007385198}. Best is trial 9 with value: 0.6077248677248678.
[I 2025-06-18 12:22:59,463] Trial 11 finished with value: 0.5458201058201058 and parameters: {'C': 49.59273114160632, 'gamma': 'auto', 'alpha': 0.0028447287940458316, 'l1_ratio': 0.38951177726190894}. Best is trial 9 with value: 0.6077248677248678.
[I 2025-06-18 12:22:59,507] Trial 12 finished with value: 0.5458201058201058 and parameters: {'C': 173.1999785833331, 'gamma': 'auto', 'alpha': 0.0016740457640130396, 'l1_ratio': 0.4825302942293711}. Best is trial 9 with value: 0.6077248677248678.
[I 2025-06-18 12:22:59,532] Trial 13 finished with value: 0.5858201058201058 and parameters: {'C': 7.055750631477379, 'gamma': 'auto', 'alpha': 0.06343615413010174, 'l1_ratio': 0.22981960083031128}. Best is trial 9 with value: 0.6077248677248678.
[I 2025-06-18 12:22:59,558] Trial 14 finished with value: 0.4753439153439153 and parameters: {'C': 548.4775451885579, 'gamma': 'auto', 'alpha': 0.031100678363698554, 'l1_ratio': 0.6057659571960006}. Best is trial 9 with value: 0.6077248677248678.
[I 2025-06-18 12:22:59,629] Trial 15 finished with value: 0.5896296296296296 and parameters: {'C': 9179.885989390967, 'gamma': 'auto', 'alpha': 0.0006588254534491306, 'l1_ratio': 0.24081303165495516}. Best is trial 9 with value: 0.6077248677248678.
[I 2025-06-18 12:22:59,663] Trial 16 finished with value: 0.6591534391534392 and parameters: {'C': 6.074674741520028, 'gamma': 'auto', 'alpha': 0.004913944796149096, 'l1_ratio': 0.5443510319735548}. Best is trial 16 with value: 0.6591534391534392.
[I 2025-06-18 12:22:59,815] Trial 17 finished with value: 0.562962962962963 and parameters: {'C': 3.9377566449053862, 'gamma': 'auto', 'alpha': 0.00010037221803208197, 'l1_ratio': 0.4446690524303188}. Best is trial 16 with value: 0.6591534391534392.
[I 2025-06-18 12:22:59,859] Trial 18 finished with value: 0.52 and parameters: {'C': 13.071572143922548, 'gamma': 'scale', 'alpha': 0.0628558904007996, 'l1_ratio': 0.7019196738358232}. Best is trial 16 with value: 0.6591534391534392.
[I 2025-06-18 12:22:59,921] Trial 19 finished with value: 0.3504761904761905 and parameters: {'C': 0.06696465820361268, 'gamma': 'auto', 'alpha': 0.010581462754393048, 'l1_ratio': 0.29059947595405633}. Best is trial 16 with value: 0.6591534391534392.
[I 2025-06-18 12:23:00,147] Trial 20 finished with value: 0.4762962962962963 and parameters: {'C': 1.0019974491679342, 'gamma': 'auto', 'alpha': 0.0006614712168936209, 'l1_ratio': 0.009565198041370682}. Best is trial 16 with value: 0.6591534391534392.
[I 2025-06-18 12:23:00,186] Trial 21 finished with value: 0.5896296296296296 and parameters: {'C': 67.75100318114457, 'gamma': 'auto', 'alpha': 0.0033850374133371354, 'l1_ratio': 0.5747922915556484}. Best is trial 16 with value: 0.6591534391534392.
[I 2025-06-18 12:23:00,221] Trial 22 finished with value: 0.6229629629629629 and parameters: {'C': 4.951804070668457, 'gamma': 'auto', 'alpha': 0.005776347273157052, 'l1_ratio': 0.5251162147329657}. Best is trial 16 with value: 0.6591534391534392.
[I 2025-06-18 12:23:00,267] Trial 23 finished with value: 0.5596296296296296 and parameters: {'C': 5.4596529680146935, 'gamma': 'auto', 'alpha': 0.0013830042406012752, 'l1_ratio': 0.6934623597971887}. Best is trial 16 with value: 0.6591534391534392.
[I 2025-06-18 12:23:00,294] Trial 24 finished with value: 0.4923809523809524 and parameters: {'C': 0.402329027529697, 'gamma': 'auto', 'alpha': 0.021261321657235228, 'l1_ratio': 0.5088997554834024}. Best is trial 16 with value: 0.6591534391534392.
[I 2025-06-18 12:23:00,320] Trial 25 finished with value: 0.5096296296296295 and parameters: {'C': 28.510533899284617, 'gamma': 'auto', 'alpha': 0.08692353935535353, 'l1_ratio': 0.38156196581395796}. Best is trial 16 with value: 0.6591534391534392.
[I 2025-06-18 12:23:00,443] Trial 26 finished with value: 0.4867724867724868 and parameters: {'C': 2.8133639209252412, 'gamma': 'scale', 'alpha': 0.00030124663568548556, 'l1_ratio': 0.1397075530726143}. Best is trial 16 with value: 0.6591534391534392.
[I 2025-06-18 12:23:00,477] Trial 27 finished with value: 0.6182010582010582 and parameters: {'C': 15.13023134502247, 'gamma': 'auto', 'alpha': 0.007441487423085766, 'l1_ratio': 0.6431556789650831}. Best is trial 16 with value: 0.6591534391534392.
[I 2025-06-18 12:23:00,525] Trial 28 finished with value: 0.33666666666666667 and parameters: {'C': 0.31154797656622235, 'gamma': 'auto', 'alpha': 0.008984900384328797, 'l1_ratio': 0.8119220316346758}. Best is trial 16 with value: 0.6591534391534392.
[I 2025-06-18 12:23:00,571] Trial 29 finished with value: 0.33666666666666667 and parameters: {'C': 0.15077360948080665, 'gamma': 'scale', 'alpha': 0.001697296782216358, 'l1_ratio': 0.7561977065771867}. Best is trial 16 with value: 0.6591534391534392.
[I 2025-06-18 12:23:00,597] Trial 30 finished with value: 0.4144444444444444 and parameters: {'C': 207.58802824892155, 'gamma': 'auto', 'alpha': 0.13358636793728015, 'l1_ratio': 0.6467297956412092}. Best is trial 16 with value: 0.6591534391534392.
[I 2025-06-18 12:23:00,631] Trial 31 finished with value: 0.6229629629629629 and parameters: {'C': 13.530373850639723, 'gamma': 'auto', 'alpha': 0.005959781724624904, 'l1_ratio': 0.5301851646789533}. Best is trial 16 with value: 0.6591534391534392.
[I 2025-06-18 12:23:00,660] Trial 32 finished with value: 0.4685714285714285 and parameters: {'C': 8.944536027527077, 'gamma': 'auto', 'alpha': 0.014148008023295655, 'l1_ratio': 0.8033596998949979}. Best is trial 16 with value: 0.6591534391534392.
[I 2025-06-18 12:23:00,687] Trial 33 finished with value: 0.5133333333333333 and parameters: {'C': 2.387597490318479, 'gamma': 'auto', 'alpha': 6.43252796293177, 'l1_ratio': 0.5160412143631204}. Best is trial 16 with value: 0.6591534391534392.
[I 2025-06-18 12:23:00,713] Trial 34 finished with value: 0.5228571428571428 and parameters: {'C': 0.7084062340895353, 'gamma': 'auto', 'alpha': 0.03911376052367361, 'l1_ratio': 0.42211813459995945}. Best is trial 16 with value: 0.6591534391534392.
[I 2025-06-18 12:23:00,747] Trial 35 finished with value: 0.5458201058201058 and parameters: {'C': 22.4665408256699, 'gamma': 'auto', 'alpha': 0.006518888009764416, 'l1_ratio': 0.3158367876887402}. Best is trial 16 with value: 0.6591534391534392.
[I 2025-06-18 12:23:00,772] Trial 36 finished with value: 0.5133333333333333 and parameters: {'C': 39.26964696190797, 'gamma': 'scale', 'alpha': 2.474444528816538, 'l1_ratio': 0.6655396407853229}. Best is trial 16 with value: 0.6591534391534392.
[I 2025-06-18 12:23:00,824] Trial 37 finished with value: 0.5458201058201058 and parameters: {'C': 2.1642571064315166, 'gamma': 'auto', 'alpha': 0.001206453495137739, 'l1_ratio': 0.5492998008934282}. Best is trial 16 with value: 0.6591534391534392.
[I 2025-06-18 12:23:00,860] Trial 38 finished with value: 0.5715343915343916 and parameters: {'C': 9.469846320998597, 'gamma': 'auto', 'alpha': 0.00567394729595836, 'l1_ratio': 0.6328330956124426}. Best is trial 16 with value: 0.6591534391534392.
[I 2025-06-18 12:23:00,894] Trial 39 finished with value: 0.4666666666666666 and parameters: {'C': 444.1227850898642, 'gamma': 'auto', 'alpha': 0.02268583143075817, 'l1_ratio': 0.7431243885694033}. Best is trial 16 with value: 0.6591534391534392.
[I 2025-06-18 12:23:00,941] Trial 40 finished with value: 0.5458201058201058 and parameters: {'C': 84.91412821447915, 'gamma': 'scale', 'alpha': 0.002277178919467903, 'l1_ratio': 0.44522398470763824}. Best is trial 16 with value: 0.6591534391534392.
[I 2025-06-18 12:23:00,977] Trial 41 finished with value: 0.6229629629629629 and parameters: {'C': 15.459248332307032, 'gamma': 'auto', 'alpha': 0.0058670958405508365, 'l1_ratio': 0.5161958804942613}. Best is trial 16 with value: 0.6591534391534392.
[I 2025-06-18 12:23:01,009] Trial 42 finished with value: 0.6591534391534392 and parameters: {'C': 4.648695124422343, 'gamma': 'auto', 'alpha': 0.009636633145223228, 'l1_ratio': 0.5373717187587882}. Best is trial 16 with value: 0.6591534391534392.
[I 2025-06-18 12:23:01,040] Trial 43 finished with value: 0.6696296296296296 and parameters: {'C': 4.137698798595101, 'gamma': 'auto', 'alpha': 0.012810290468212701, 'l1_ratio': 0.5472358602685671}. Best is trial 43 with value: 0.6696296296296296.
[I 2025-06-18 12:23:01,069] Trial 44 finished with value: 0.5228571428571428 and parameters: {'C': 0.9772058409187774, 'gamma': 'auto', 'alpha': 0.013448345270284314, 'l1_ratio': 0.5535741583811766}. Best is trial 43 with value: 0.6696296296296296.
[I 2025-06-18 12:23:01,096] Trial 45 finished with value: 0.6258201058201058 and parameters: {'C': 4.626774704825047, 'gamma': 'auto', 'alpha': 0.04054598195367899, 'l1_ratio': 0.46030701841175803}. Best is trial 43 with value: 0.6696296296296296.
[I 2025-06-18 12:23:01,120] Trial 46 finished with value: 0.5128571428571429 and parameters: {'C': 4.2123368618197485, 'gamma': 'auto', 'alpha': 0.3393902082719903, 'l1_ratio': 0.46437573605097193}. Best is trial 43 with value: 0.6696296296296296.
[I 2025-06-18 12:23:01,148] Trial 47 finished with value: 0.5458201058201058 and parameters: {'C': 1.5081175448634156, 'gamma': 'auto', 'alpha': 0.03914659185229946, 'l1_ratio': 0.3148640350004624}. Best is trial 43 with value: 0.6696296296296296.
[I 2025-06-18 12:23:01,172] Trial 48 finished with value: 0.4723809523809523 and parameters: {'C': 5.3943621045709875, 'gamma': 'auto', 'alpha': 0.16576786255239936, 'l1_ratio': 0.4182664055159664}. Best is trial 43 with value: 0.6696296296296296.
[I 2025-06-18 12:23:01,197] Trial 49 finished with value: 0.19714285714285712 and parameters: {'C': 0.5690122340818029, 'gamma': 'auto', 'alpha': 0.7919590440953956, 'l1_ratio': 0.5807208120829416}. Best is trial 43 with value: 0.6696296296296296.
[I 2025-06-18 12:23:01,204] A new study created in memory with name: no-name-a60a389a-1272-46fe-91b3-3c9b0c0ec28c
[I 2025-06-18 12:23:01,224] Trial 0 finished with value: 0.2038095238095238 and parameters: {'C': 0.14096675490461208, 'gamma': 'scale', 'alpha': 0.8448758931656905, 'l1_ratio': 0.7799758081188035}. Best is trial 0 with value: 0.2038095238095238.
[I 2025-06-18 12:23:01,243] Trial 1 finished with value: 0.3504761904761905 and parameters: {'C': 0.43207151101399793, 'gamma': 'auto', 'alpha': 6.175850414870771, 'l1_ratio': 0.8759326347420947}. Best is trial 1 with value: 0.3504761904761905.
[I 2025-06-18 12:23:01,262] Trial 2 finished with value: 0.5566666666666666 and parameters: {'C': 1.4025024214492712, 'gamma': 'auto', 'alpha': 0.3660244821898272, 'l1_ratio': 0.37025075479039493}. Best is trial 2 with value: 0.5566666666666666.
[I 2025-06-18 12:23:01,282] Trial 3 finished with value: 0.4833333333333333 and parameters: {'C': 23.29040906436821, 'gamma': 'scale', 'alpha': 0.7313632065748894, 'l1_ratio': 0.8826411906361166}. Best is trial 2 with value: 0.5566666666666666.
[I 2025-06-18 12:23:01,307] Trial 4 finished with value: 0.5704232804232804 and parameters: {'C': 1.5463788579841122, 'gamma': 'scale', 'alpha': 0.006984254077381198, 'l1_ratio': 0.9331401019825216}. Best is trial 4 with value: 0.5704232804232804.
[I 2025-06-18 12:23:01,341] Trial 5 finished with value: 0.5082010582010582 and parameters: {'C': 80.95969425082201, 'gamma': 'auto', 'alpha': 0.003838668517152234, 'l1_ratio': 0.5680986526260692}. Best is trial 4 with value: 0.5704232804232804.
[I 2025-06-18 12:23:01,411] Trial 6 finished with value: 0.5496296296296296 and parameters: {'C': 1639.6997761073915, 'gamma': 'auto', 'alpha': 0.0005234004872142785, 'l1_ratio': 0.7042609711183354}. Best is trial 4 with value: 0.5704232804232804.
[I 2025-06-18 12:23:01,436] Trial 7 finished with value: 0.5580952380952382 and parameters: {'C': 168.84486187434905, 'gamma': 'auto', 'alpha': 0.016244403817471303, 'l1_ratio': 0.9093159589724725}. Best is trial 4 with value: 0.5704232804232804.
[I 2025-06-18 12:23:01,457] Trial 8 finished with value: 0.4966666666666666 and parameters: {'C': 0.02284837598099766, 'gamma': 'scale', 'alpha': 0.23681255196123402, 'l1_ratio': 0.5946247799344488}. Best is trial 4 with value: 0.5704232804232804.
[I 2025-06-18 12:23:01,491] Trial 9 finished with value: 0.5304232804232804 and parameters: {'C': 15.843859334916775, 'gamma': 'auto', 'alpha': 0.004449817791422694, 'l1_ratio': 0.5029668331126184}. Best is trial 4 with value: 0.5704232804232804.
[I 2025-06-18 12:23:01,692] Trial 10 finished with value: 0.6058201058201058 and parameters: {'C': 3303.1968883340887, 'gamma': 'scale', 'alpha': 0.0001145778543018467, 'l1_ratio': 0.0334797007385198}. Best is trial 10 with value: 0.6058201058201058.
[I 2025-06-18 12:23:01,906] Trial 11 finished with value: 0.6058201058201058 and parameters: {'C': 8708.022061141337, 'gamma': 'scale', 'alpha': 0.00013616959584753364, 'l1_ratio': 0.021834110043384883}. Best is trial 10 with value: 0.6058201058201058.
[I 2025-06-18 12:23:02,087] Trial 12 finished with value: 0.5547619047619048 and parameters: {'C': 6868.368836005118, 'gamma': 'scale', 'alpha': 0.00011282503407864071, 'l1_ratio': 0.017136792223030543}. Best is trial 10 with value: 0.6058201058201058.
[I 2025-06-18 12:23:02,291] Trial 13 finished with value: 0.6058201058201058 and parameters: {'C': 923.5915415919786, 'gamma': 'scale', 'alpha': 0.0001183590222897017, 'l1_ratio': 0.027347076896018292}. Best is trial 10 with value: 0.6058201058201058.
[I 2025-06-18 12:23:02,346] Trial 14 finished with value: 0.49677248677248675 and parameters: {'C': 7714.4730414127025, 'gamma': 'scale', 'alpha': 0.0012293379214718316, 'l1_ratio': 0.22104807328689263}. Best is trial 10 with value: 0.6058201058201058.
[I 2025-06-18 12:23:02,421] Trial 15 finished with value: 0.49677248677248675 and parameters: {'C': 453.50016708525624, 'gamma': 'scale', 'alpha': 0.0007104776668815128, 'l1_ratio': 0.163939010599974}. Best is trial 10 with value: 0.6058201058201058.
[I 2025-06-18 12:23:02,443] Trial 16 finished with value: 0.5382010582010582 and parameters: {'C': 2529.7631796327096, 'gamma': 'scale', 'alpha': 0.0665855469180033, 'l1_ratio': 0.31921432172055075}. Best is trial 10 with value: 0.6058201058201058.
[I 2025-06-18 12:23:02,548] Trial 17 finished with value: 0.5482010582010581 and parameters: {'C': 150.23953349698152, 'gamma': 'scale', 'alpha': 0.0003145332920790602, 'l1_ratio': 0.1310791825909302}. Best is trial 10 with value: 0.6058201058201058.
[I 2025-06-18 12:23:02,591] Trial 18 finished with value: 0.5185714285714286 and parameters: {'C': 5298.408131233816, 'gamma': 'scale', 'alpha': 0.0017036692189379512, 'l1_ratio': 0.35825342500760865}. Best is trial 10 with value: 0.6058201058201058.
[I 2025-06-18 12:23:02,737] Trial 19 finished with value: 0.5696296296296296 and parameters: {'C': 262.37387240574884, 'gamma': 'scale', 'alpha': 0.00019596329764105883, 'l1_ratio': 0.10574389342491532}. Best is trial 10 with value: 0.6058201058201058.
[I 2025-06-18 12:23:02,761] Trial 20 finished with value: 0.5482010582010581 and parameters: {'C': 48.37145111876067, 'gamma': 'scale', 'alpha': 0.056503672308523704, 'l1_ratio': 0.20188972856126697}. Best is trial 10 with value: 0.6058201058201058.
[I 2025-06-18 12:23:02,945] Trial 21 finished with value: 0.49190476190476196 and parameters: {'C': 956.196897217291, 'gamma': 'scale', 'alpha': 0.00010860120395159702, 'l1_ratio': 0.01123137934880896}. Best is trial 10 with value: 0.6058201058201058.
[I 2025-06-18 12:23:03,181] Trial 22 finished with value: 0.4833333333333333 and parameters: {'C': 670.038327591963, 'gamma': 'scale', 'alpha': 0.0003796133617297247, 'l1_ratio': 1.2086873784927787e-05}. Best is trial 10 with value: 0.6058201058201058.
[I 2025-06-18 12:23:03,299] Trial 23 finished with value: 0.5482010582010581 and parameters: {'C': 2201.741004565104, 'gamma': 'scale', 'alpha': 0.00011038977148409058, 'l1_ratio': 0.28125499483258487}. Best is trial 10 with value: 0.6058201058201058.
