[I 2025-06-18 12:23:06,906] Trial 49 finished with value: 0.5437566137566139 and parameters: {'C': 209.99600450977178, 'gamma': 'scale', 'alpha': 0.0019511252103650864, 'l1_ratio': 0.12773497505254122}. Best is trial 32 with value: 0.6758201058201058.
[I 2025-06-18 12:23:07,112] A new study created in memory with name: no-name-9efbb47b-e85e-4a6c-be89-505c6285ea69
  0%|          | 0/50 [00:00<?, ?it/s]                                        0%|          | 0/50 [00:00<?, ?it/s]Best trial: 0. Best value: 0.294603:   0%|          | 0/50 [00:00<?, ?it/s]                                                                           Best trial: 0. Best value: 0.294603:   2%|▏         | 1/50 [00:00<00:02, 23.94it/s]Best trial: 0. Best value: 0.294603:   2%|▏         | 1/50 [00:00<00:02, 23.84it/s]                                                                                   Best trial: 0. Best value: 0.294603:   4%|▍         | 2/50 [00:00<00:01, 32.89it/s]Best trial: 2. Best value: 0.518672:   4%|▍         | 2/50 [00:00<00:01, 32.79it/s]                                                                                   Best trial: 2. Best value: 0.518672:   6%|▌         | 3/50 [00:00<00:01, 37.11it/s]Best trial: 2. Best value: 0.518672:   6%|▌         | 3/50 [00:00<00:01, 37.02it/s]                                                                                   Best trial: 2. Best value: 0.518672:   8%|▊         | 4/50 [00:00<00:01, 37.11it/s]Best trial: 4. Best value: 0.543175:   8%|▊         | 4/50 [00:00<00:01, 37.05it/s]Best trial: 4. Best value: 0.543175:  10%|█         | 5/50 [00:00<00:00, 46.27it/s]                                                                                   Best trial: 4. Best value: 0.543175:  10%|█         | 5/50 [00:00<00:00, 46.27it/s]Best trial: 5. Best value: 0.544127:  10%|█         | 5/50 [00:00<00:00, 46.27it/s]                                                                                   Best trial: 5. Best value: 0.544127:  12%|█▏        | 6/50 [00:00<00:00, 46.27it/s]Best trial: 6. Best value: 0.563434:  12%|█▏        | 6/50 [00:00<00:00, 46.27it/s]                                                                                   Best trial: 6. Best value: 0.563434:  14%|█▍        | 7/50 [00:00<00:00, 46.27it/s]Best trial: 7. Best value: 0.596825:  14%|█▍        | 7/50 [00:00<00:00, 46.27it/s]                                                                                   Best trial: 7. Best value: 0.596825:  16%|█▌        | 8/50 [00:00<00:00, 46.27it/s]Best trial: 7. Best value: 0.596825:  16%|█▌        | 8/50 [00:00<00:00, 46.27it/s]                                                                                   Best trial: 7. Best value: 0.596825:  18%|█▊        | 9/50 [00:00<00:00, 46.27it/s]Best trial: 7. Best value: 0.596825:  18%|█▊        | 9/50 [00:00<00:00, 46.27it/s]Best trial: 7. Best value: 0.596825:  20%|██        | 10/50 [00:00<00:01, 34.36it/s]                                                                                    Best trial: 7. Best value: 0.596825:  20%|██        | 10/50 [00:00<00:01, 34.36it/s]Best trial: 7. Best value: 0.596825:  20%|██        | 10/50 [00:00<00:01, 34.36it/s]                                                                                    Best trial: 7. Best value: 0.596825:  22%|██▏       | 11/50 [00:00<00:01, 34.36it/s]Best trial: 7. Best value: 0.596825:  22%|██▏       | 11/50 [00:00<00:01, 34.36it/s]                                                                                    Best trial: 7. Best value: 0.596825:  24%|██▍       | 12/50 [00:00<00:01, 34.36it/s]Best trial: 7. Best value: 0.596825:  24%|██▍       | 12/50 [00:00<00:01, 34.36it/s]                                                                                    Best trial: 7. Best value: 0.596825:  26%|██▌       | 13/50 [00:00<00:01, 34.36it/s]Best trial: 7. Best value: 0.596825:  26%|██▌       | 13/50 [00:00<00:01, 34.36it/s]Best trial: 7. Best value: 0.596825:  28%|██▊       | 14/50 [00:00<00:02, 16.93it/s]                                                                                    Best trial: 7. Best value: 0.596825:  28%|██▊       | 14/50 [00:00<00:02, 16.93it/s]Best trial: 7. Best value: 0.596825:  28%|██▊       | 14/50 [00:00<00:02, 16.93it/s]                                                                                    Best trial: 7. Best value: 0.596825:  30%|███       | 15/50 [00:00<00:02, 16.93it/s]Best trial: 7. Best value: 0.596825:  30%|███       | 15/50 [00:00<00:02, 16.93it/s]                                                                                    Best trial: 7. Best value: 0.596825:  32%|███▏      | 16/50 [00:00<00:02, 16.93it/s]Best trial: 16. Best value: 0.603651:  32%|███▏      | 16/50 [00:00<00:02, 16.93it/s]Best trial: 16. Best value: 0.603651:  34%|███▍      | 17/50 [00:00<00:01, 18.01it/s]                                                                                     Best trial: 16. Best value: 0.603651:  34%|███▍      | 17/50 [00:00<00:01, 18.01it/s]Best trial: 16. Best value: 0.603651:  34%|███▍      | 17/50 [00:00<00:01, 18.01it/s]                                                                                     Best trial: 16. Best value: 0.603651:  36%|███▌      | 18/50 [00:00<00:01, 18.01it/s]Best trial: 16. Best value: 0.603651:  36%|███▌      | 18/50 [00:00<00:01, 18.01it/s]                                                                                     Best trial: 16. Best value: 0.603651:  38%|███▊      | 19/50 [00:00<00:01, 18.01it/s]Best trial: 16. Best value: 0.603651:  38%|███▊      | 19/50 [00:00<00:01, 18.01it/s]Best trial: 16. Best value: 0.603651:  40%|████      | 20/50 [00:00<00:01, 19.84it/s]                                                                                     Best trial: 16. Best value: 0.603651:  40%|████      | 20/50 [00:00<00:01, 19.84it/s]Best trial: 16. Best value: 0.603651:  40%|████      | 20/50 [00:00<00:01, 19.84it/s]                                                                                     Best trial: 16. Best value: 0.603651:  42%|████▏     | 21/50 [00:01<00:01, 19.84it/s]Best trial: 16. Best value: 0.603651:  42%|████▏     | 21/50 [00:01<00:01, 19.84it/s]                                                                                     Best trial: 16. Best value: 0.603651:  44%|████▍     | 22/50 [00:01<00:01, 19.84it/s]Best trial: 22. Best value: 0.650577:  44%|████▍     | 22/50 [00:01<00:01, 19.84it/s]Best trial: 22. Best value: 0.650577:  46%|████▌     | 23/50 [00:01<00:01, 21.40it/s]                                                                                     Best trial: 22. Best value: 0.650577:  46%|████▌     | 23/50 [00:01<00:01, 21.40it/s]Best trial: 22. Best value: 0.650577:  46%|████▌     | 23/50 [00:01<00:01, 21.40it/s]                                                                                     Best trial: 22. Best value: 0.650577:  48%|████▊     | 24/50 [00:01<00:01, 21.40it/s]Best trial: 22. Best value: 0.650577:  48%|████▊     | 24/50 [00:01<00:01, 21.40it/s]                                                                                     Best trial: 22. Best value: 0.650577:  50%|█████     | 25/50 [00:01<00:01, 21.40it/s]Best trial: 22. Best value: 0.650577:  50%|█████     | 25/50 [00:01<00:01, 21.40it/s]Best trial: 22. Best value: 0.650577:  52%|█████▏    | 26/50 [00:01<00:01, 18.88it/s]                                                                                     Best trial: 22. Best value: 0.650577:  52%|█████▏    | 26/50 [00:01<00:01, 18.88it/s]Best trial: 22. Best value: 0.650577:  52%|█████▏    | 26/50 [00:01<00:01, 18.88it/s]                                                                                     Best trial: 22. Best value: 0.650577:  54%|█████▍    | 27/50 [00:01<00:01, 18.88it/s]Best trial: 22. Best value: 0.650577:  54%|█████▍    | 27/50 [00:01<00:01, 18.88it/s]                                                                                     Best trial: 22. Best value: 0.650577:  56%|█████▌    | 28/50 [00:01<00:01, 18.88it/s]Best trial: 22. Best value: 0.650577:  56%|█████▌    | 28/50 [00:01<00:01, 18.88it/s]Best trial: 22. Best value: 0.650577:  58%|█████▊    | 29/50 [00:01<00:01, 14.04it/s]                                                                                     Best trial: 22. Best value: 0.650577:  58%|█████▊    | 29/50 [00:01<00:01, 14.04it/s]Best trial: 22. Best value: 0.650577:  58%|█████▊    | 29/50 [00:01<00:01, 14.04it/s]                                                                                     Best trial: 22. Best value: 0.650577:  60%|██████    | 30/50 [00:01<00:01, 14.04it/s]Best trial: 22. Best value: 0.650577:  60%|██████    | 30/50 [00:01<00:01, 14.04it/s]                                                                                     Best trial: 22. Best value: 0.650577:  62%|██████▏   | 31/50 [00:01<00:01, 14.04it/s]Best trial: 22. Best value: 0.650577:  62%|██████▏   | 31/50 [00:01<00:01, 14.04it/s]Best trial: 22. Best value: 0.650577:  64%|██████▍   | 32/50 [00:01<00:01, 15.21it/s]                                                                                     Best trial: 22. Best value: 0.650577:  64%|██████▍   | 32/50 [00:01<00:01, 15.21it/s]Best trial: 22. Best value: 0.650577:  64%|██████▍   | 32/50 [00:01<00:01, 15.21it/s]                                                                                     Best trial: 22. Best value: 0.650577:  66%|██████▌   | 33/50 [00:01<00:01, 15.21it/s]Best trial: 22. Best value: 0.650577:  66%|██████▌   | 33/50 [00:01<00:01, 15.21it/s]Best trial: 22. Best value: 0.650577:  68%|██████▊   | 34/50 [00:01<00:01, 15.88it/s]                                                                                     Best trial: 22. Best value: 0.650577:  68%|██████▊   | 34/50 [00:01<00:01, 15.88it/s]Best trial: 22. Best value: 0.650577:  68%|██████▊   | 34/50 [00:01<00:01, 15.88it/s]                                                                                     Best trial: 22. Best value: 0.650577:  70%|███████   | 35/50 [00:02<00:00, 15.88it/s]Best trial: 22. Best value: 0.650577:  70%|███████   | 35/50 [00:02<00:00, 15.88it/s]Best trial: 22. Best value: 0.650577:  72%|███████▏  | 36/50 [00:02<00:00, 14.35it/s]                                                                                     Best trial: 22. Best value: 0.650577:  72%|███████▏  | 36/50 [00:02<00:00, 14.35it/s]Best trial: 22. Best value: 0.650577:  72%|███████▏  | 36/50 [00:02<00:00, 14.35it/s]                                                                                     Best trial: 22. Best value: 0.650577:  74%|███████▍  | 37/50 [00:02<00:00, 14.35it/s]Best trial: 22. Best value: 0.650577:  74%|███████▍  | 37/50 [00:02<00:00, 14.35it/s]Best trial: 22. Best value: 0.650577:  76%|███████▌  | 38/50 [00:02<00:00, 13.80it/s]                                                                                     Best trial: 22. Best value: 0.650577:  76%|███████▌  | 38/50 [00:02<00:00, 13.80it/s]Best trial: 22. Best value: 0.650577:  76%|███████▌  | 38/50 [00:02<00:00, 13.80it/s]                                                                                     Best trial: 22. Best value: 0.650577:  78%|███████▊  | 39/50 [00:02<00:00, 13.80it/s]Best trial: 22. Best value: 0.650577:  78%|███████▊  | 39/50 [00:02<00:00, 13.80it/s]                                                                                     Best trial: 22. Best value: 0.650577:  80%|████████  | 40/50 [00:02<00:00, 13.80it/s]Best trial: 22. Best value: 0.650577:  80%|████████  | 40/50 [00:02<00:00, 13.80it/s]Best trial: 22. Best value: 0.650577:  82%|████████▏ | 41/50 [00:02<00:00, 16.11it/s]                                                                                     Best trial: 22. Best value: 0.650577:  82%|████████▏ | 41/50 [00:02<00:00, 16.11it/s]Best trial: 22. Best value: 0.650577:  82%|████████▏ | 41/50 [00:02<00:00, 16.11it/s]                                                                                     Best trial: 22. Best value: 0.650577:  84%|████████▍ | 42/50 [00:02<00:00, 16.11it/s]Best trial: 22. Best value: 0.650577:  84%|████████▍ | 42/50 [00:02<00:00, 16.11it/s]                                                                                     Best trial: 22. Best value: 0.650577:  86%|████████▌ | 43/50 [00:02<00:00, 16.11it/s]Best trial: 22. Best value: 0.650577:  86%|████████▌ | 43/50 [00:02<00:00, 16.11it/s]Best trial: 22. Best value: 0.650577:  88%|████████▊ | 44/50 [00:02<00:00, 17.80it/s]                                                                                     Best trial: 22. Best value: 0.650577:  88%|████████▊ | 44/50 [00:02<00:00, 17.80it/s]Best trial: 22. Best value: 0.650577:  88%|████████▊ | 44/50 [00:02<00:00, 17.80it/s]                                                                                     Best trial: 22. Best value: 0.650577:  90%|█████████ | 45/50 [00:02<00:00, 17.80it/s]Best trial: 22. Best value: 0.650577:  90%|█████████ | 45/50 [00:02<00:00, 17.80it/s]Best trial: 22. Best value: 0.650577:  92%|█████████▏| 46/50 [00:02<00:00, 14.78it/s]                                                                                     Best trial: 22. Best value: 0.650577:  92%|█████████▏| 46/50 [00:02<00:00, 14.78it/s]Best trial: 22. Best value: 0.650577:  92%|█████████▏| 46/50 [00:02<00:00, 14.78it/s]                                                                                     Best trial: 22. Best value: 0.650577:  94%|█████████▍| 47/50 [00:02<00:00, 14.78it/s]Best trial: 22. Best value: 0.650577:  94%|█████████▍| 47/50 [00:02<00:00, 14.78it/s]Best trial: 22. Best value: 0.650577:  96%|█████████▌| 48/50 [00:02<00:00, 14.38it/s]                                                                                     Best trial: 22. Best value: 0.650577:  96%|█████████▌| 48/50 [00:02<00:00, 14.38it/s]Best trial: 22. Best value: 0.650577:  96%|█████████▌| 48/50 [00:02<00:00, 14.38it/s]                                                                                     Best trial: 22. Best value: 0.650577:  98%|█████████▊| 49/50 [00:02<00:00, 14.38it/s]Best trial: 22. Best value: 0.650577:  98%|█████████▊| 49/50 [00:02<00:00, 14.38it/s]Best trial: 22. Best value: 0.650577: 100%|██████████| 50/50 [00:02<00:00, 13.93it/s]Best trial: 22. Best value: 0.650577: 100%|██████████| 50/50 [00:02<00:00, 16.70it/s]
